source,source_type,matched_keywords,title,summary,url,published_at,writer,paper_page,raw_keyword
연합뉴스,yna_api,산업통상부,"조선업 사상 첫 노사정협의체…원하청 격차, 인력 공백 등 논의","...합뉴스) 옥성구 기자 = 최근 호황을 맞은 조선업이 지속 가능한 성장을 이어갈 수 있도록 조선업 사상 첫 노사정 협의체가 출범했다. 고용노동부와 산업통상부 는 13일 서울 중구 프레스센터에서 '조선업 노사정 협의체' 발족식을 열고, 운영협의체와 실무협의체 첫 회의를 연달아 개최했다. 발족식에는 ...",https://www.yna.co.kr/view/AKR20260712049800530,2026-07-13T10:30:00+09:00,옥성구,,산업통상부
연합뉴스,yna_api,기후에너지환경부,"울주군, 공단 사업장 대상 대기오염방지시설 설치·개선 지원","... 울주군은 웅촌면 고연·와지공단 일대 소규모 사업장을 대상으로 '우리동네 맑은공기 패키지 지원사업'에 나선다고 13일 밝혔다. 이번 사업은 기후에너지환경부 공모사업 일환으로 지역 대기질 개선과 소규모 사업장의 환경투자 부담 완화를 위한 것이다. 사업비는 국비 50%, 시비 20%, 군비 20% 등 총 ...",https://www.yna.co.kr/view/AKR20260713048200057,2026-07-13T10:14:54+09:00,장영은,,기후부
연합뉴스,yna_api,한국전력,"횡성군 ""햇빛소득마을 허위 홍보 주의…계약 전 확인해야""","...과 계약을 유도하는 것으로 나타났다. 군은 사업은 주민 동의만으로 추진되지 않으며 토지·저수지 관리기관 협의, 발전사업 허가, 주민 수용성, 한국전력공사 계통연계 조건, 에너지저장장치(ESS) 설치 여부 등 여러 요건을 종합적으로 검토해 결정된다고 설명했다. 특히 국·공유지 태양광은 사전 협의와 ...",https://www.yna.co.kr/view/AKR20260713047600062,2026-07-13T09:56:29+09:00,임보연,,한국전력
연합뉴스,yna_api,"김성환, 김정관, 산업통상부","李대통령, 국가재정전략회의 주재…재정운용·투자방향 등 논의","... 메가 프로젝트' 지원을 주제로 한 두 번째 세션에선 배경훈 부총리 겸 과학기술정보통신부 장관이 '메가프로젝트, AI 데이터센터·피지컬 AI', 김정관 산업통상부 장관이 '메가프로젝트, 반도체·AI 로봇', 김성환 기후에너지부 장관이 '첨단산업 전력·용수 공급을 위한 인프라 혁신전략', 김윤덕 국토교통부 ...",https://www.yna.co.kr/view/AKR20260713040400001,2026-07-13T09:48:43+09:00,설승은,,산업통상부
뉴스1,news1_api,산업통상부,"롯데홈쇼핑, LA서 K-브랜드 수출 플랫폼 '이설' 론칭","롯데홈쇼핑은 오는 17일부터 내달 15일까지 미국 로스앤젤레스(LA) 쇼핑몰인 '더 그로브'(The Grove)에서 업계 최초로 국내 중소기업 39개사가 참여하는 K-뷰티·라이프스타일 팝업 스토어를 운영한다고 13일 밝혔다.이번 행사는 산업통상부와 대한무역투자진흥공사(KOTRA)가 추진하는 유통기업 해외 진출 지원사업의 일환이다. 롯데홈쇼핑은 2016년부터 국내 중소기업의 유럽, 동남아 등 해외 진출을 지속적으로 지원해 온 성과를 인정받아 올해",https://www.news1.kr/industry/distribution/6225908,2026-07-13T09:42:50+09:00,유민주 기자,,산업통상부
연합뉴스,yna_api,"한국전력, 한전","전력 이어 도로도 연결…SK텔링크, 스타링크 공급 확대","...에도 국내 최초로 저궤도 위성통신이 도입된다. SK텔링크는 지난달 한국전력공사 , 스타링크코리아와 국가 전력 인프라에 저궤도 위성통신을 적용하기 ...를 구축한 바 있다. SK텔링크 이신용 위성사업본부장은 ""해운사, 한전 , 도로공사가 공통으로 요구한 것은 결국 끊기지 않는 통신이었다""며, ...",https://www.yna.co.kr/view/AKR20260713031700017,2026-07-13T09:33:45+09:00,박형빈,,한국전력
연합뉴스,yna_api,산업부,원주 뿌리기술에 AI 입힌다…첨단 제조혁신 거점 도약,"산업부 공모 선정…2028년까지 100억원 투입, 제조혁신 기반 확충 (원주=연합뉴스) 임보연 기자 = 강원 원주시가 산업통상자원부 공모사업인 '산업혁신기반 구축사업'에 최종 선정돼 지역 제조산업 경쟁력 강화에 속도를 ...",https://www.yna.co.kr/view/AKR20260713038300062,2026-07-13T09:31:39+09:00,임보연,,산업통상부
연합뉴스,yna_api,"산업부, 산업통상부","산업부, EU 신철강 조치 영향 점검…제철소 찾아 애로 청취","...치 시행에 따른 국내 철강업계의 애로사항과 수출 여건을 점검했다. 산업통상부 는 여한구 통상교섭본부장이 충남 당진시에 있는 현대제철 당진제철소를 방문해 현장 간담회를 진행했다고 13일 밝혔다. 산업부 와 현대제철 측은 EU 신철강 조치의 세부 운영 방식, 한국의 전용 무관세 ...",https://www.yna.co.kr/view/AKR20260712040100003,2026-07-13T09:30:00+09:00,장보인,,산업통상부
뉴스1,news1_api,산업통상부,"경북도, 식품로봇 개발·실증·인증 원스톱 지원","경북도는 13일 산업통상부의 ‘2026년 로봇 플래그쉽 지역거점 구축사업’에 선정돼 국비 9억5000만원을 확보하고 총사업비 19억원 규모의 식품로봇 실증 거점 구축에 착수한다고 밝혔다.경북은 총사업비 155억원을 투입한 식품로봇 푸드테크 연구지원센터와 아시아 최초 NSF 국제위생표준 시험인증 기반을 활용해 외식 현장 실증과 보급을 확대한다.센터에는 실제 식당 주방을 재현한 ‘스마트키친 테스트베드’를 구축해 매장별 조리 공정과 메뉴, 작업 동선",https://www.news1.kr/local/daegu-gyeongbuk/6225861,2026-07-13T09:22:59+09:00,김대벽 기자,,산업통상부
뉴스1,news1_api,한전,"대한전선, 명지대와 해저케이블 구조 검증 역량 강화 맞손",대한전선(001440)이 해저케이블 품질 및 기술 경쟁력 강화를 위해 전문 연구기관과 협력을 확대한다.대한전선은 지난 10일 경기 용인 소재 명지대 하이브리드 구조실험센터에서 해저케이블 구조 성능 검증 협력을 위한 업무협약(MOU)을 체결했다고 13일 밝혔다.이번 협약은 해저케이블 구조 성능 검증 체계를 고도화하고 관련 기술 연구를 위한 협력 기반을 마련하고자 추진했다.양측은 해저케이블 등 전력·통신 케이블 및 산업 관련 제품 구조 성능 시험과,https://www.news1.kr/industry/general-industry/6225797,2026-07-13T09:07:17+09:00,정윤미 기자,,한국전력
연합뉴스,yna_api,산업통상부,"롯데홈쇼핑, 자체 기획 K브랜드 수출 플랫폼 '이설' 첫선","...좌 등 다양한 체험 행사를 한다. 2층에서는 K-팝, K-푸드를 비롯해 즉석 사진 촬영, K-팝 강좌 등의 콘텐츠를 체험할 수 있다. 이번 행사는 산업통상부 와 대한무역투자진흥공사(KOTRA·코트라)가 추진하는 '유통 기업 해외 진출 지원 사업'의 일환으로, 롯데홈쇼핑은 2016년부터 국내 중소기업의 해외 ...",https://www.yna.co.kr/view/AKR20260713019800030,2026-07-13T08:48:41+09:00,정수연,,산업통상부
뉴스1,news1_api,산업통상부,부산 명지녹산산단에 전국 첫 엣지 AI 데이터센터 들어선다,부산시가 산업통상자원부의 '2026년 산업단지 엣지 AIDC 실증 시범사업' 공모에 최종 선정되면서 전국 최초의 산업단지 엣지 인공지능(AI) 데이터센터 구축에 나선다.부산시는 산업통상부가 주관한 공모사업에 '부산 조선·해양 엣지 AI 데이터센터 구축사업'이 선정됐다고 13일 밝혔다.이번 사업은 산업단지 입주기업들이 개별적으로 구축하기 어려운 AI 연산 인프라를 공동으로 제공해 제조업의 인공지능 전환(AX)을 촉진하기 위한 사업이다. 시는 조선,https://www.news1.kr/local/busan-gyeongnam/6225720,2026-07-13T08:39:48+09:00,이주현 기자,,산업통상부
뉴스1,news1_api,산업통상부,"""신평장림산단에 재생에너지 생산 기반 구축""…부산시, 국비 200억 확보","부산시가 산업통상부의 '산업단지 에너지 자급자족 인프라 구축사업' 공모에 최종 선정돼 국비 200억 원을 확보했다. 시는 이를 바탕으로 신평장림산업단지를 친환경 에너지 기반의 스마트 산업단지로 전환한다는 계획이다.부산시는 한국남부발전 컨소시엄과 공동으로 신청한 공모사업에 선정돼 총사업비 320억 원 규모의 사업을 추진한다고 13일 밝혔다. 사업은 2029년 12월까지 국비 200억 원, 시비 30억 원, 민간투자 90억 원 등 총 320억 원을",https://www.news1.kr/local/busan-gyeongnam/6225662,2026-07-13T08:06:45+09:00,이주현 기자,,산업통상부
연합뉴스,yna_api,산업통상부,"부산 신평장림산단, 친환경 에너지 기반 스마트 그린단지로 전환",(부산=연합뉴스) 김선호 기자 = 부산시는 한국남부발전 컨소시엄과 신청한 산업통상부 의 산업단지 에너지 자급자족 인프라 구축사업 공모에 최종 선정돼 국비 200억원을 확보했다고 13일 밝혔다. 이번 사업은 조성된 지 20년이 넘은 신평장림 산업단지에 재생에너지 생산·관리 기반을 구축하고 입주기업의 ...,https://www.yna.co.kr/view/AKR20260713014900051,2026-07-13T08:05:31+09:00,김선호,,산업통상부
연합뉴스,yna_api,산업통상부,부산 명지녹산산단에 조선·해양 AI 데이터센터…183억원 투입,(부산=연합뉴스) 김선호 기자 = 부산시는 산업통상부 가 주관한 '2026년 산업단지 엣지 인공지능데이터센터(AIDC) 실증 시범사업' 공모에 부산 조선·해양 엣지 AI 데이터센터 구축사업이 최종 선정됐다고 13일 밝혔다. 시는 이번 사업을 통해 명지녹산 국가산업단지에 전국 산업단지 최초로 그래픽처리장치(...,https://www.yna.co.kr/view/AKR20260713014700051,2026-07-13T08:02:03+09:00,김선호,,산업통상부
